Titel;Satz;Position1;Position2;Suspense
Am Kamin;Dann nahmen wir unsre Bücher, sagten ihr gute Nacht und gingen eine Treppe tiefer in die kleine Schlafkammer ihres Sohnes, wo wir noch einige Stunden unsre Studien fortzusetzen pflegten.;16843;17029;/0
Tatsachen im Falle Waldemar;der Puls kaum fühlbar, der Atem nur mit Hilfe eines dem Kranken vor den Mund gehaltenen Spiegels bemerkbar, die Augen wie im Schlaf geschlossen, die Glieder hart und kalt wie Marmor.;10689;10871;/1
Eine Spukgeschichte;seht ihr nichts;5280;5295;/1
Am Kamin;denn er hatte seine Lebenspläne keineswegs gänzlich aufgegeben, und wo der Abend nicht reichte, nahm er unbedenklich die Nacht zu Hülfe.;15229;15365;/0
Am Kamin;Vor einigen Jahren verlebte ich, wie Sie wissen, mit meiner Frau ein paar Wochen auf dem Gute meines Bruders.;31453;31562;/0
Am Kamin;in trockner Sommerzeit aber kann es keinen besseren Weg geben, der feine graue Ton, aus welchem der Boden besteht, ist dann fest und eben, und der Wagen geht sanft und leicht darüber hin.;3804;3991;/0
Am Kamin;Von den mancherlei derartigen Gesprächen und Erzählungen jenes Abends ist mir indessen nur eine einfache Geschichte im Gedächtnis geblieben.;4849;4989;/1
Am Kamin;Nur daraus vermag ich es zu erklären, daß der sonst so verständige Mann von einer fast unbegreiflichen Angst vor einer demnächstigen Sektion seiner Leiche heimgesucht wurde, welche er andererseits von der wissenschaftlichen Neugier meiner Herren Kollegen mit gutem Grund erwarten konnte.;43639;43926;/0
Am Kamin;"Wie der Traum ausgegangen, weiß ich nicht;";28951;28993;/0
Am Kamin;Was denn freilich?;21182;21200;/0
Am Kamin;Als er eben in Sekunda eingetreten war, starb der Vater, welcher ein kleines städtisches Amt bekleidet hatte, und hinterließ Sohn und Witwe in den bedrängtesten Umständen.;14314;14485;/0
Tatsachen im Falle Waldemar;Es war die Ansicht beider Ärzte, daß Herr Waldemar gegen Mitternacht des folgenden Tages (eines Sonntags) sterben werde.;5941;6061;/1
Am Kamin;Aber Sie haben mich getäuscht, Herr Kollege!;47696;47740;/1
Tatsachen im Falle Waldemar;Die Neugier beider Ärzte war in höchstem Grade geweckt.;10196;10251;/1
Am Kamin;Oder wenn man abends vor Schlafengehen unter alle Betten und Kommoden leuchtet, und ich weiß eine, die das sehr eifrig ins Werk setzen wird.;49569;49709;/0
Tatsachen im Falle Waldemar;"Die Augen öffneten sich langsam, die Pupillen drehten sich so weit nach aufwärts, bis sie ganz unsichtbar waren;";13289;13401;/1
Am Kamin;Gott gibt's den Trägen im Schlaf.;32341;32374;/0
Am Kamin;Indem ich aber die Augen anstrengte, um schärfer zu scheu, wurde die Gestalt undeutlich, und bald sah ich nichts mehr als die nackten Wände.;40415;40555;/1
Eine Spukgeschichte;Da schlägt die Wanduhr achte (es war also die neunte Stunde), und leichenblaß sinkt Adelgunde in den Lehnsessel zurück – das Nähzeug entfällt ihren Händen!;9310;9465;/1
Am Kamin;"Das nicht, Herr Assessor;";7501;7526;/0
Eine Spukgeschichte;dicht vor mir!;9679;9693;/1
Tatsachen im Falle Waldemar;Selbstverständlich finde ich es ganz natürlich, daß der seltsame Fall des Herrn Waldemar viel erörtert worden ist.;0;114;/1
Am Kamin;Aber wir fühlten beide, daß das ein Abschied für das Leben sei.;17796;17859;/1
Am Kamin;Es war still drinnen, die Nachtlampe war herabgebrannt, und unter dem dunklen Betthimmel fand er beim trüben Schein der Dämmerung die Leiche seiner Mutter.;19783;19938;/1
Eine Spukgeschichte;Keine Spur irgendeiner Überspannung war zu finden, wiewohl das schmerzliche Lächeln, der tränenschwere Blick wenigstens irgendeinen physischen Krankheitszustand, der auch auf das Gemüt des zarten Kindes feindlich einwirken mußte, vermuten ließ.;2526;2770;/0
Eine Spukgeschichte;Du weißt, was ich von Spukgeschichten halte, du weißt, daß ich mich gegen alle Visionärs damit brüste, daß die Geisterwelt, unerachtet ich sie oft mit verwogener Keckheit in die Schranken rief, noch niemals sich bemühte, mich für meinen Frevel zu züchtigen, aber Cyprians Erzählung gibt einen ganz andern Punkt zu bedenken, als den der bloßen chimärischen Spukerei.;12836;13201;/0
Am Kamin;Halt den Mund, liebes Klärchen!;1275;1306;/0
Tatsachen im Falle Waldemar;»Ja, schlafe noch – sterbe.«;12823;12851;/1
Eine Spukgeschichte;die Gestalt;5298;5309;/1
Eine Spukgeschichte;Sie rennen fort, bis auf eine, die, die beherzteste, sich ermutigt, auf Adelgunden zuspringt, sie in die Arme fassen will.;5480;5602;/1
Am Kamin;So?;13632;13635;/0
Am Kamin;Bei der immer stärker hereinbrechenden Dunkelheit überfiel mich mit einem Male ein Gefühl von Einsamkeit, und ich wollte eben in die Stube zu meiner Mutter gehen, als ich die Haustürglocke schellen und die alte Frau van A... hereintreten sah.;27833;28075;/1
Am Kamin;denn die alte Stadt ist ein wahres Gespensternest und noch voll von Heidenglauben.;4332;4414;/1
Am Kamin;»Mit Gunst, Herr Vater«, entgegnete der Gesell, »traut Ihr mir nicht, oder fehlt's da wo im Hause bei den Meistersleuten?«;8140;8262;/0
Tatsachen im Falle Waldemar;Die Verknöcherung hatte mit ganz ungewöhnlicher Schnelligkeit um sich gegriffen, und die Rippeneiterung hatte man erst in den letzten drei Tagen wahrgenommen.;5600;5758;/0
Tatsachen im Falle Waldemar;Ich verschob daher meine Maßnahmen bis zum anderen Abend gegen acht Uhr, wo das Eintreffen eines Studenten der Medizin, des Herrn Theodor L...l, zu dem ich einige Beziehungen hatte, mich weiterer Befürchtungen enthob.;6955;7172;/0
Am Kamin;aber er vermochte nichts zu sehen als den völlig leeren Raum.;10323;10384;/1
Am Kamin;Schon in der Nähe des Hauses, während er zwischen den Rabatten auf dem geraden Steige des Gartens entlangging, warf er zufällig einen Blick nach dem Fenster seiner Kammer hinauf.;12806;12984;/1
Eine Spukgeschichte;eine Stunde früher?;9597;9616;/1
Tatsachen im Falle Waldemar;Das erste Anzeichen von Wiederbelebung bot sich in einer teilweisen Herabsenkung der Iris.;19019;19109;/1
Am Kamin;Freilich –;21169;21179;/0
Am Kamin;"Wart noch; ich will mich vor dem Kamin auf den Teppich legen und Kienäpfel zuwerfen.";785;869;/0
Am Kamin;Der prophezeit aus der Teetasse oder vielmehr aus der Tasse Tee wie die Hexe aus dem Kaffeesatz.;35779;35875;/0
Eine Spukgeschichte;Er blieb in der siegreichen Schlacht bei W.;11947;11990;/0
Am Kamin;"Was nun folgt, habe ich später aus dem Munde meines Freundes gehört; denn ich selbst verließ schon am Tage darauf die Stadt.";17860;17984;/0
Eine Spukgeschichte;Kann ein Zustand qualvoller sein?;11833;11866;/0
Tatsachen im Falle Waldemar;"Zunächst blieb zu beobachten, ob ein solcher Patient für magnetische Einwirkungen besonders empfänglich war;";1011;1119;/0
Tatsachen im Falle Waldemar;Ich war so furchtbar entsetzt, daß ich einen Moment lang nicht wußte, was beginnen.;20067;20150;/1
Eine Spukgeschichte;In der magischen Dämmerung beginnen sie allerlei seltsame Tänze, indem sie Elfen und andere flinke Spukgeister vorstellen wollen.;4449;4578;/1
Eine Spukgeschichte;Der Obrist, ganz Gram und Verzweiflung, folgte den Fahnen zum neuen Feldzuge.;11869;11946;/0
Am Kamin;ich stand auf und verschloß den angefangenen Brief in meinen Sekretär, ich konnte mich nicht überwinden, ihn zu Ende zu schreiben.;40664;40794;/1
Eine Spukgeschichte;Was!;9590;9594;/1
Am Kamin;"Nach dem Essen, als die Zigarren angezündet waren, gerieten wir unversehens in die Spukgeschichten, was dort eben nicht schwer ist;";4200;4331;/0
Am Kamin;In dem Herbste, ehe Sie im Frühjahr darauf in unsre Nachbarschaft kamen, bemerkte ich mehrfach, wenn ich des Morgens auf den Boden kam, daß in der Nacht jemand, und zwar in scheinbarer Hast, über dem Hafer gewesen sei.;32672;32890;/1
Eine Spukgeschichte;Daher jene sonderbare Art sie zu behandeln, deren ich erst erwähnte. ;7037;7106;/0
Am Kamin;Wo bleiben da unsre Geschichten?;20842;20874;/0
Am Kamin;Es ist kein Hehl dabei, ich kann es in diesem vertrauten Kreise wohl mitteilen, zumal Sie den, welchen es betrifft, gekannt und auch wohl wertgehalten haben.;42816;42973;/0
Tatsachen im Falle Waldemar;Der rechte Arm gehorchte wie vorher der Führung meiner Hand.;11960;12020;/1
Am Kamin;Nun, da verwechsle ich die Geschichte.;24357;24395;/0
Am Kamin;So habe ich manche Stunde dort verbracht in gemeinsamer Arbeit oder in gemütlichem Gespräch.;15366;15458;/0
Am Kamin;Allein aus verschiedenen Gründen mußte ich den Verdacht aufgeben.;33340;33405;/0
Am Kamin;Indessen, da es hierorts weder einen Torf noch einen Teekomfort gibt – Sie kennen das Ding wohl nicht einmal? –, so akzeptiere ich das Kännchen Sprit.;21571;21721;/0
Tatsachen im Falle Waldemar;sie waren so eiskalt wie immer.;11928;11959;/1
Tatsachen im Falle Waldemar;Ich muß ferner erwähnen, daß dies Glied meinem Willen nicht mehr unterworfen war.;16849;16930;/1
Am Kamin;Ich weiß nicht, meine Damen, ob Sie jemals durch die Marsch gefahren sind!;3658;3732;/0
Tatsachen im Falle Waldemar;Ich machte den Versuch, und er mißlang.;19425;19464;/1
Am Kamin;Da träumte mir eines Nachts, ich stehe im Mondschein auf dem Haferboden am Fenster.;33406;33489;/0
Am Kamin;der Vers ist schon gedruckt.;7527;7555;/0
Eine Spukgeschichte;Denkt euch die schönste Gestalt, das wunderherrlichste Antlitz.;1803;1866;/0
Am Kamin;Kann ich mir auch nichts bei denken.;13444;13480;/0
Eine Spukgeschichte;Die älteste war ein munteres Ding, bis zur Ausgelassenheit lebendig, nicht ohne Geist, aber so wie sie nicht fünf Schritte gehen konnte, ohne wenigstens drei Entrechats zu machen, so sprang sie auch im Gespräch, in all ihrem Tun rastlos von einem Dinge zum andern.;514;778;/0
Eine Spukgeschichte;Adelgunde erholte sich in derselben Nacht so ganz und gar von ihrem Schreck, daß man durchaus keine böse Folgen befürchtete, sondern die ganze Sache für völlig abgetan hielt.;6122;6296;/0
Am Kamin;"Wenn die Mutter wachte, saß er in dem alten Lehnstuhl vor ihrem Bett und sprach leise zu ihr oder las ihr aus der Bibel vor; oder er war nur bei ihr, daß ihre Augen zärtlich auf ihm ruhen konnten.";18351;18547;/0
Eine Spukgeschichte;Da ist es;6466;6475;/1
Am Kamin;Weshalb?;48896;48904;/0
Eine Spukgeschichte;Ich überwand wohl bald diese Schauer und mußte, als ich das tief in sich gekehrte Mädchen zum Sprechen vermocht, mir selbst gestehen, daß das Seltsame, ja Spukhafte dieser Erscheinung nur im Äußern liege, keinesweges sich aber aus dem Innern heraus offenbare.;2141;2400;/0
Am Kamin;Plötzlich, und ehe es noch ganz in seine Nähe gekommen, war alles wieder still.;10385;10464;/1
Am Kamin;Unser Geselle ließ sich das nicht anfechten, sondern ging noch an demselben Abend zu seinem neuen Meister.;8463;8569;/0
Am Kamin;weder sie noch ihr Sohn verkannten das.;17423;17462;/0
Am Kamin;"Sie haben nicht fehlgesehen;";37027;37055;/0
Eine Spukgeschichte;Mag er es denn erlösen?;16256;16279;/0
Am Kamin;"die Kammer war fast hell vom Mondschein;";10241;10281;/1
Am Kamin;"wir machten wie sonst des Mittags unsern gemeinschaftlichen Spaziergang, und abends, wenn er aus seiner Kanzlei nach Hause gekommen war, saßen wir in dem von ihm und seiner Mutter gemeinschaftlich bewohnten Zimmer und nahmen miteinander die Lektionen durch, welche am folgenden Tage in der Schule vorkommen sollten;";14913;15228;/0
Tatsachen im Falle Waldemar;Ich vermute, daß keinem der Anwesenden die Schrecken des Totenbettes fremd waren, aber Herr Waldemar bot in diesem Augenblick einen so entsetzlichen Anblick, daß alle aus der Nähe des Bettes zurückwichen.;14022;14226;/1
Am Kamin;"Er atmete tief auf;";5961;5980;/1
Tatsachen im Falle Waldemar;"Die Beine waren lang ausgestreckt;";9860;9894;/1
Am Kamin;"Ich wollte aufstehen und die Sache sogleich untersuchen, aber ich schalt mich eben Narren;";34314;34404;/1
Tatsachen im Falle Waldemar;aber es wurde uns nicht schwer, dahin übereinzukommen, daß ein solches Vorgehen nichts Gutes fördern könne.;17841;17948;/0
Am Kamin;Wo war ich denn?;1309;1325;/0
Am Kamin;Es war eine Luft des Friedens und der Stille in diesem Zimmer, wie ich sie nirgend sonst empfunden habe.;16213;16317;/0
Eine Spukgeschichte;Ich kann mir es denken, daß ich den plötzlichen Schreck irgendeiner grauenhaften Erscheinung wohl ertragen könnte, das unheimliche, den äußern Sinn in Anspruch nehmende Treiben eines unsichtbaren Wesens würde mich dagegen unfehlbar wahnsinnig machen.;14636;14886;/0
Tatsachen im Falle Waldemar;Es hatte nicht in ihrer Absicht gelegen, wiederzukommen, auf mein Ersuchen jedoch erklärten sie sich bereit, gegen zehn Uhr am folgenden Abend noch einmal nach dem Kranken sehen zu wollen.;6250;6438;/0
Am Kamin;Gewiß, Herr Medizinalrat.;47585;47610;/1
Am Kamin;Will ich ganz dem Scharfsinn der Damen überlassen und Ihnen lieber etwas anderes erzählen, wo ein solcher Zusammenhang sich von selbst ergibt, indem der Reflex der Begebenheit mit dieser selbst scheinbar in einen Moment zusammenfällt.;13891;14125;/0
Am Kamin;und von den ungeheuren Besitzungen war nur noch ein altes Giebelhaus in der Stadt zurückgeblieben, in welchem die Letzte dieses Namens den Rest ihrer Tage in Einsamkeit verlebte.;25169;25347;/0
Am Kamin;Plötzlich, zu meinem großen Bedauern, wurde ich nach H. abkommandiert.;39385;39455;/0
Am Kamin;es geht auch nachts ein altes glasäugiges dreibeiniges Pferd durch die Straßen, und wo es stehenbleibt und in die Fenster guckt, wird bald ein Sarg herausgetragen. ;4510;4674;/1
Eine Spukgeschichte;fasse dich, Adelgunde!;10090;10112;/1
Am Kamin;indessen, ich beginne wenigstens schon davon zu reden.;3483;3537;/0
Am Kamin;Der Medizinalrat schwieg, und es entstand eine augenblickliche Stille in der Gesellschaft, die wohl dem Andenken des Verstorbenen gelten mochte.;46143;46287;/0
Eine Spukgeschichte;Die Idee der Erscheinung des Gespenstes sei mit dem Ausschlagen der neunten Abendstunde so fest verknüpft, daß die innere Kraft des Geistes sie nicht mehr trennen könne, und es käme daher nur darauf an, diese Trennung von außen her zu bewirken.;8082;8326;/0
Tatsachen im Falle Waldemar;Trotz alledem schien er im vollkommenen Besitz seiner Geisteskräfte und war auch körperlich nicht so schwach, als man hätte annehmen sollen.;4600;4740;/0
Am Kamin;Da erscheint der Trank, bei dem der selige Hoffmann seine Serapionsgeschichten erzählte.;3122;3210;/0
Tatsachen im Falle Waldemar;Die Gliedmaßen des Patienten waren von eisiger Kälte.;9184;9237;/1
Tatsachen im Falle Waldemar;An Herrn Waldemar war nicht das geringste Lebenszeichen mehr zu bemerken, und da wir annahmen, daß er tot sei, wollten wir ihn der Obhut der Pflegeleute überlassen, als seine Zunge von einer heftigen Vibration ergriffen wurde.;14392;14618;/1
Am Kamin;Ja – aber Träumen ist doch nicht Spuken –;3002;3043;/0
Am Kamin;"›Nein, nein, Papa, es war ein wirklicher Wolf; ";1712;1759;/1
Am Kamin;Es war schon dunkel.;44475;44495;/1
Am Kamin;"Dann nach einigen Tagen kam die Begräbnisfeier;";27428;27475;/1
Am Kamin;Er kehrte um und suchte sich für diese Nacht ein Unterkommen in der Herberge.;13186;13263;/0
Tatsachen im Falle Waldemar;Dennoch bot er nicht den Anblick eines Toten.;10872;10917;/1
Am Kamin;Mir selbst ist es in einem ähnlichen Falle nach dem Sprichwort ergangen:;32268;32340;/0
Eine Spukgeschichte;›Seht ihr nichts‹;5193;5210;/1
Am Kamin;Das einzige, sehr hohe Fenster mit kleinen, in Blei gefaßten Scheiben schien, soviel er bei dem Mondschein draußen erkennen konnte, nach einem großen Garten hinaus zu liegen.;9471;9645;/0
Am Kamin;Der Zustand des Kranken war derart, daß darüber die differentesten Meinungen bei den zu Rate gezogenen Ärzten herrschten.;43168;43289;/1
Tatsachen im Falle Waldemar;Ein Versuch, aus dem Arm Blut zu ziehen, schlug fehl.;16795;16848;/1
Am Kamin;Hierauf besah er sich sein neues Quartier.;9197;9239;/0
Am Kamin;Im Hause des Arztes lebte eine ältliche Schwester desselben, welche den kleinen Peter ganz besonders in ihr Herz geschlossen hatte.;2002;2133;/0
Am Kamin;»Wie meint Er das, Martin?« fragte ich.;34878;34917;/1
Am Kamin;Aber ein Teil dieser Geschichten tritt eben mit dem Reiz des Rätsels an uns heran und drängt uns, den Dingen nachzuspüren, die, wenngleich selber längst vergangen, noch solche Schatten aus dem leeren Raume fallen lassen.;13640;13860;/0
Am Kamin;So schlief er endlich ein. ;1907;1934;/0
Tatsachen im Falle Waldemar;Er blieb in jeder Hinsicht genau so, wie ich ihn zuletzt beschrieben habe, ausgenommen, daß der Spiegel keine Atmung mehr erkennen ließ.;16658;16794;/1
Am Kamin;Der Gesell, so wenig angenehm ihm diese Dinge waren, beschloß bei sich, gegen jedermann zu schweigen, am wenigsten aber sich von jenem Unheimlichen vom Platze verdrängen zu lassen.;12160;12340;/0
Am Kamin;sie rührt mir gar zu ungeduldig in der Bowle.;7632;7677;/0
Tatsachen im Falle Waldemar;Ich glaube, ich habe nun alles erzählt, was zum Verständnis für des Schlafwachenden damaligen Zustand notwendig ist.;17393;17509;/0
Am Kamin;Ich meine unsern verstorbenen Freund, den Justizrat Z.;42974;43028;/1
Am Kamin;Er hielt sich vor mehreren Jahren vorübergehend in B. auf, wo derzeit auch der in wissenschaftlichen und künstlerischen Kreisen bekannte Geheime Medizinalrat W. lebte.;41816;41983;/0
Tatsachen im Falle Waldemar;und es ist vermutlich der unglückliche Ausgang dieses Experimentes, das in Laienkreisen zu so vielen Erörterungen Anlaß gab, die ich nicht anders als ungerechtfertigt bezeichnen kann.;18704;18887;/1
Eine Spukgeschichte;Merkwürdig, höchst merkwürdig ist es, daß Adelgunde seit jenem verhängnisvollen Abende von dem Phantom befreit ist.;11993;12108;/0
Tatsachen im Falle Waldemar;Er gab keine Antwort, doch ich bemerkte ein Zittern um seinen Mund und wurde dadurch veranlaßt, meine Frage ein zweites und drittes Mal zu wiederholen.;11389;11540;/1
Eine Spukgeschichte;Die Obristin mühte sich, allerlei Lustiges zu erzählen, der Obrist fing an, wie es seine Art war, wenn er vorzüglich bei Laune, die alte Französin ein wenig aufzuziehen, worin ihm Auguste (das ältere Fräulein) beistand.;9049;9268;/0
Am Kamin;Weißt du nicht, wieviel Uhr es gewesen?‹ ;2657;2698;/1
Am Kamin;Ich kann Ihnen hierauf leider keine Antwort geben.;30987;31037;/0
Am Kamin;Es wurde ein Komitee von vier Festordnern niedergesetzt, zu denen auch ich gehörte, und demselben das ganze Arrangement der Sache, vor allem aber die Aufspürung des Ballsaales, aufgetragen.;37716;37905;/0
Am Kamin;Ich?;48891;48895;/0
Am Kamin;Ich?;20629;20633;/0
Am Kamin;Ich?;170;174;/0
Am Kamin;Ich?;7680;7684;/0
Am Kamin;endlich brach draußen der Mond durch die Wolken und schien in die Kammer, aber er beleuchtete nur die nackten Wände.;12043;12159;/1
Eine Spukgeschichte;Denn eben fällt mir ein, von Offizieren gehört zu haben, der Obrist sei beim Angriff plötzlich, wie von Furien getrieben, ins feindliche Feuer hineingesprengt.;13692;13851;/1
Eine Spukgeschichte;Genug, seit jenem unglückseligen Abende behauptete Adelgunde, sowie es abends neune schlug, daß die Gestalt dicht vor ihr stehe und einige Sekunden weile, ohne daß irgendein Mensch außer ihr auch nur das mindeste wahrnehmen konnte oder in irgendeiner psychischen Empfindung die Nähe eines unbekannten geistigen Prinzips gespürt haben sollte.;6541;6882;/1
Am Kamin;Ich mache gar keine Augen.;522;548;/0
Am Kamin;"Es ist das Herz meines Freundes«, sagte er, das Glas mit beiden Händen fassend;";48251;48330;/1
Am Kamin;Ich kehrte erst nach mehrtägiger Abwesenheit in die Stadt zurück.;44409;44474;/0
Am Kamin;ich verspeiste mit großem Appetit die leckeren Butterkringel, die beim Leichenschmaus in der Nachbarschaft verteilt wurden, und sah von unsern Treppensteinen aus den mit schwarzem Tuch bezogenen Sarg aus dem alten Hause hinaus- und die lange Straße hinabtragen.;27476;27737;/0
Eine Spukgeschichte;will man mich denn wahnsinnig machen!;10154;10191;/1
Am Kamin;Aber er gestand demselben, daß in der Tat an jenem Abend das anatomische Gelüste über seine Gewissenhaftigkeit den Sieg davongetragen habe.;48542;48681;/1
Tatsachen im Falle Waldemar;Um Gottes willen;19915;19931;/1
Tatsachen im Falle Waldemar;Es wurde nun angeregt, daß ich versuchen solle, wie früher den Arm des Patienten mir gehorsam zu machen.;19320;19424;/1
Am Kamin;aber er hatte sich geirrt, die Tür seiner Kammer war eingeklinkt, wie er in der Nacht sie aus der Hand gelassen.;19601;19713;/1
Eine Spukgeschichte;Aber eine Totenblässe liegt auf Lipp' und Wangen, und die Gestalt bewegt sich leise, langsam, gemessenen Schrittes, und wenn dann ein halblautes Wort von den kaum geöffneten Lippen ertönt und im weiten Saal verklingt, fühlt man sich von gespenstischen Schauern durchbebt.;1867;2138;/1
Am Kamin;Aber du weinst ja!;20608;20626;/0
Am Kamin;Sßt! ;1356;1361;/0
Am Kamin;So habe ich es schon seit vielen Jahren gehalten.;32622;32671;/0
Am Kamin;"Meine gnädigste Frau, Sie werden mir zugehen, daß, so wie das Bier der Feind, so der Tee der Freund der denkenden Menschen ist; und es dürfte daher die Art, wie dieser Freund in einem Hause be- respektive mißhandelt, wie er serviert und genossen wird, zu allerlei nicht gar zu fehltreffenden Schlußfolgerungen in der angedeuteten Beziehung berechtigen.";36233;36585;/0
Am Kamin;Dem kleinen Peter träumte eines Nachts – –;1039;1081;/1
Am Kamin;Warum erzählst du auch so dumme Geschichten!;20638;20682;/0
Am Kamin;›Nun?‹;2485;2491;/1
Am Kamin;Währenddes verging die Nacht, und der Tag fing eben an zu grauen, da wurde er plötzlich wie mit sanfter Gewalt aus dem Schlaf emporgezogen.;19308;19447;/1
Am Kamin;"Wie ich dahin gelangt sein sollte, wußte ich nicht anzugeben; denn es war mir sehr wohl bewußt, daß die Falltür verschlossen sei.";33490;33619;/0
Eine Spukgeschichte;»Nein, nein,« sprach Theodor, »der Strom, der in krausen Wellen daherbrauste, muß sanft abgeleitet werden, und dazu ist ein Fragment sehr tauglich, das ich vor langer Zeit, besonders dazu angeregt, aufschrieb.;16281;16490;/0
Am Kamin;Als aber später meine Mutter aufstand und in die Küche ging, folgte ich ihr und erzählte ihr dort genau, was mir in den beiden Nächten geträumt hatte.;30360;30510;/0
Am Kamin;"ich will auch nicht leugnen, daß mir mitunter die Gedanken so gekommen sind; jedoch geschehen ist mir niemals etwas.";42656;42772;/1
Am Kamin;Es war ein zerlumptes Weib aus der Stadt, das vor der alten Dame stand.;26650;26721;/0
Am Kamin;das liegt in der Luft;177;198;/0
Am Kamin;Sei dem, wie ihm wolle, diese meine Freundin, der ich ein treues Gedächtnis bewahre, war im Heimlichen wie im Unheimlichen sehr zu Hause.;24396;24533;/0
Am Kamin;"Verteidigen Sie sich, oder – prophezeien Sie lieber einmal;";36137;36196;/0
Am Kamin;"Endlich nach vielen Bemühungen war er gefunden; in einem großen, ziemlich baufälligen Hause der Vorstadt, das in früheren Jahren, als B. noch Universitätsstadt war, zum öffentlichen Tanzlokale gedient hatte.";37906;38113;/0
Am Kamin;"Mit Hülfe von Stipendien, deren es dort viele gab, hätte mein Freund dessenungeachtet wohl seinen Plan, die Rechte zu studieren, durchführen können;";14488;14636;/0
Am Kamin;Nun erhob er den weißgepuderten Kopf und sagte:;42494;42541;/1
Am Kamin;r begrub den Kopf an seines Vaters Brust und wollte nicht wieder in sein Korbbettchen zurück.;1813;1906;/0
Am Kamin;Aber sie hatte noch sehr blanke, braune Augen, Hans, und die lebhafte Röte ihres Angesichts zeugte von der Erregbarkeit ihres Herzens, und wenn sie mir damals auch in gewählten Worten ihre Freude über unsre Verlobung aussprach, weil der böse Leumund die Besuche des jungen Mannes nun nicht mehr mißdeuten könnte, so habe ich doch darin das verhüllte Bekenntnis gegenseitiger Neigung nicht verkennen können.;23372;23778;/0
Am Kamin;"In meiner Kindheit lebte von der ganzen Familie nur noch eine alte Dame, die Witwe des längst verstorbenen Pfenningmeisters van A..., die übrigen Glieder der Familie waren gestorben, zum Teil auf seltsame und gewalttätige Weise ums Leben gekommen;";24921;25168;/1
Tatsachen im Falle Waldemar;ich zog die Striche, die ich bereits früher am wirksamsten bei ihm angewendet hatte.;8162;8246;/1
Am Kamin;Schauder?;48828;48837;/0
Am Kamin;wir gingen zu dem Herrn Agenten, wir plauderten mit ihm, wir machten uns liebenswürdig und brachten es auch wirklich dahin, daß der nachgiebige Mann, augenscheinlich wider bessere Einsicht, das Korn in den oberen Räumen des Gebäudes unterbringen ließ.;38897;39148;/0
Tatsachen im Falle Waldemar;"ferner ob die Empfänglichkeit in solchem Zustand, falls sie vorhanden, stärker oder schwächer war als sonst;";1120;1228;/0
Tatsachen im Falle Waldemar;Um Herrn Waldemar aus der Trance zu erwecken, brachte ich die üblichen Striche zur Anwendung. ;18888;18982;/1
Am Kamin;So kam es eines Abends, daß ich, der ich ihn mit jeweiliger Zuziehung des Professors X. in den letzten Jahren behandelt hatte, ihm auf sein dringendes Verlangen das feierliche Versprechen gab, bei Eintritt des Todes die Eröffnung seiner Leiche unter jeder Bedingung zu verhindern.;43927;44207;/0
Tatsachen im Falle Waldemar;Dessenungeachtet ist es meine Pflicht, fortzufahren.;14339;14391;/0
Am Kamin;›Ja‹, entgegnete er, noch immer wie im Traum, ›es war doch nicht gut darüber wegzukommen.‹;6110;6200;/1
Am Kamin;Was die Ursache seines Todes gewesen, vermag ich nicht mehr anzugeben.;7273;7343;/1
Am Kamin;Es kam mir vor, als ob es Getreidekörner seien.;40367;40414;/1
Tatsachen im Falle Waldemar;Mit ein paar schnellen Querstrichen brachte ich die Augenlider zum Beben, und nach einigen weiteren Strichen schlossen sie sich ganz.;9492;9625;/1
Am Kamin;Eines Abends, da er in Gesellschaft mit demselben zusammentraf, geriet die Unterhaltung in Veranlassung eines soeben erschienenen Buches, »Über das Leben der Seele«, unmerklich in jene dunkle Region, wo wir so gern mit unsicherem Finger umhertasten.;41984;42233;/0
